{
  "protocol_version": "1",
  "namespace": "eip155",
  "chain_id": "84532",
  "name": "Base Sepolia",
  "family": "evm",
  "signing_scheme": "secp256k1",
  "confirmations_required": 12,
  "capabilities": {
    "chain_signatures": true,
    "contract_deploy": true,
    "eas": false,
    "safe": true,
    "baal": false,
    "intents_settlement": false
  },
  "status": "proposed"
}
